{
  "id": "client-deposits",
  "specVersion": 2,
  "version": 4,
  "title": "Deposits",
  "description": "Current deposit balances, with the number of deposit accounts.",
  "data": {
    "query": {
      "metrics": [
        "depositsUsd",
        "depositAccounts"
      ]
    },
    "columns": [
      {
        "name": "depositAccounts",
        "label": "Accounts"
      }
    ]
  },
  "view": {
    "primitive": "metric",
    "value": "depositsUsd",
    "secondary": "depositAccounts",
    "polarity": "higherIsBetter"
  },
  "layout": {
    "span": 3
  },
  "provenance": {
    "author": "starter",
    "sampleParams": {
      "clientId": "CL-0001"
    }
  }
}
